{
  "work_unit": "work-unit-454-runtime-gate-form",
  "behavior_form": "gate",
  "criterion_coverage": [
    {
      "criterion": "A runtime-backed documentation-deliverable work-unit delivers its behavior dimension without scenarios.",
      "status": "covered",
      "gates": [
        {
          "name": "gate-form behavior artifacts stay schema-valid",
          "criterion": "A runtime-backed documentation-deliverable work-unit delivers its behavior dimension without scenarios.",
          "category": "structural",
          "result": "pass"
        }
      ]
    }
  ],
  "documentation": {
    "updated": ["schemas/README.md", "CHANGELOG.md"],
    "verified_accurate": ["protocols/take/PROTOCOL.md", "protocols/verify/PROTOCOL.md"],
    "follow_up_work_units": []
  }
}
