{
  "work_unit": "work-unit-454-runtime-gate-form",
  "behavior_form": "gate",
  "criterion_coverage": [
    {
      "criterion": "A documentation-deliverable criterion with no gate evidence is recorded honestly as uncovered.",
      "status": "uncovered"
    }
  ],
  "documentation": {
    "updated": [],
    "verified_accurate": ["protocols/verify/PROTOCOL.md"],
    "follow_up_work_units": []
  }
}
